disease,postLink,postHeading,postContent
Covid,https://connect.mayoclinic.org/discussion/loss-of-appetite-with-ldn/,Loss of appetite with LDN,Just starting titrating up with LDN. Started at 0.5mg/day. At 1.0 mg daily level after 5 days have noticed pronounced loss of appetite. Does this happen to others? Does it go away? 
Covid,https://connect.mayoclinic.org/discussion/sharing-a-study-im-participating-in-for-fatigue/,Sharing a study I'm participating in for fatigue ,"Sharing- I'm participating in a study led by Mt Sanai NYC Post Covid Dept looking at fatigue and endocrine dysfunction. It involves a blood draw at LabCorp to check the endocrine function and a functional survey. Im told if the Drs find an issue with your labs, you continue with draw every 3 months and the labs are explained to you and the Drs will discuss with your providers. The post Covid  website is also a great source for information as they seem more independent imho "
Covid,https://connect.mayoclinic.org/discussion/any-treatments-for-rebound-covid/,Any treatments for rebound COVID?,"Developed symptoms of COVID, tested positive, took Paxlovid for five days, tested negative. Several days later symptoms started up again.  Now testing positive for COVID again. Do I need further treatment or just tough it out? "
Covid,https://connect.mayoclinic.org/discussion/please-share-what-helps-for-severe-anxiety-burning-skin-feeling/,PLEASE share what helps for severe anxiety & burning skin feeling,"Suffering now for 3 yrs now.  Every week brings on an unbearable new symptom.   I just can't go on like this.  I can't get any help from the numerous doctors and specialists I've seen, to include Mayo.  My 40+ symptoms and pain are unbea Like many of us, I was such a very, very healthy and active person pre-covid.  I hate this beast that has robbed me of my life.  Why would anyone create such a horrible virus and weapon.  I worked so hard in saving for retirement and looked so forward to that day.  I want my life back.   rable. As I type, I am experiencing. indescribable and so such painful burning sensations of my skin everywhere along with nerve pain.  On a scale of 1-10. . . and 20!  This includes pain even in my eyes. My anxiety is off the charts which I have never experienced in my life, pre-covid.  I can't even lay down and close my eyes to rests because the min my eyes close, I'm jolted into what feels like a ""fight or flight"" mode which I'm in 24/7. Please, if anyone on this forum has the same terrible symptoms and found relief, please chime in for support.  I'm pacing around the house due to the pain, I can't lay down, it's worse and I just want to scream.   Every day, all day I pray to our Dearest Lord Jesus for help.  Being alone and so scared doesn't help.  Why is it most everyone in the world gets covid, some even 2+ times and recovers fine, and we're suffering so?   I wasn't vaccinated, but I know others that weren't as well, and they recovered.   I keep thinking, ""if I only had been vaccinated, I wouldn't be living in such torment. or when I had covid if I had received the monoclonal antibodies, but my doctor would order it and told me I would be fine.  Wrong!  I'm in such agonizing pain and down to 89  lbs now and no help anywhere. "
Covid,https://connect.mayoclinic.org/discussion/i-have-lingering-covid-cough-after-completing-the-covid-medication/,I have lingering Covid cough after completing the COVID medication.   ,Can I transmit Covid after 10 days of isolation and completion of Covid meds if I still have a lingering cough.  I am a volunteer helper for a elderly house bound woman who not received her Covid booster yet.  I don’t want her to catch Covid from me.  Yet she need’s physical help.  Comments please. 
Covid,https://connect.mayoclinic.org/discussion/nac-supplement/,NAC supplement?,A friend of mine suggested the supplement NAC (N-acetylcysteine) for my long Covid. I have never heard of it. Has anyone tried this? 
Covid,https://connect.mayoclinic.org/discussion/continued-success-with-post-covid-gi-gerd-and-more-issues/,Continued success with post-Covid  GI (GERD and more) issues,"I wanted to followup on a prior post about my success in addressing post-Covid GI issues, largely abdominal pain, GERD-like symptoms, and changes in stool. For a month I have been taking Famotidine when I wake up and Famotidine and Nortritptyline when I go to bed. I  (try to) limit snacking two hours before going to sleep. All I am now experiencing is mild GERD – coughing when I lie down to sleep and take a very deep breath.  I am able to regularly workout and eat a careful diet of lean protein and salads to keep my weight down. My tinnitus and headaches remain annoying but this is so much better. Fingers crossed. "
Covid,https://connect.mayoclinic.org/discussion/multiple-autoimmune-diseases-post-covid/,Multiple Autoimmune Diseases & Post Covid,"Has anyone else been having pain levels of 8-12 not normal.  Things in pain, cognitive, insomnia, nerve issues, etc since having Covid? "
Covid,https://connect.mayoclinic.org/discussion/has-anyone-had-the-new-booster-shot/,Has anyone had the 2023 updated Covid shot?  ,"Does anyone have experience with the new booster shot? If so, what has been your experience? My intergrative doctor said the booster shot will be hard on my body right now. She also said getting sick would be the same. Her treatments are helping me, and I’m improving. I don’t want a shot to set me back, but also don’t want Covid, which would also set me back, plus – well, Covid. I’m trying to decide whether or not to get it. I’m up on all of my shots until now. I’ve had LC for a year. I would love to hear if anyone has gotten the shot, and how it’s affected them. "
Covid,https://connect.mayoclinic.org/discussion/did-paxlovid-also-relieve-your-arthritis-and-autoimmune-symptoms/,Did PAXLOVID also relieve your arthritis and autoimmune symptoms?  ,"Hi, everyone I have been diagnosed with autoimmune diseases. 
The diagnoses have changed over time (lupus, not lupus, spondyloarthropathy, akylosing spondylitis, rheumatoid arthritis, psoriatic arthritis, Raynaud's, Sjorgren and maybe others that I have forgotten… sorry about the spelling). When I took Paxlovid for Covid, many of my symptoms disappeared or were significantly reduced. Has this happened to anyone else? I'm thinking that perhaps my autoimmune disease is somehow based on a VIRUS, since paxlovid is an anti-viral and it was like a miracle cure for my symptoms. I told my rheumatologist about it, but I couldn't get her to focus on the logical connection between the anti-viral (paxlovid) and the reduction in my symptoms. It was very frustrating. I actually cried in my car after the appointment. I think this could be a game-changing piece of evidence in my medical treatment and diagnosis. And maybe for other autoimmune disease sufferers, too! But I don't know where to turn with this evidence. What do you think I should do? What doctor should I go to? 
My primary care doctor probably won't offer anything; he never intervenes in my rheumatological care. Please let me know if you had the same experience: an anti-viral medication (paxlovid or another one) reduced your autoimmune/arthritis symptoms. I searched around online, and it was hard to find and hard to understand information there. In the CDC's PubMed, I found one source that indicates the possibility that immune suppressing medications can reactivate the Epstein Barr virus in some patients. Epstein Barr causes fatigue, among other symptoms, but fatigue is one of my worst symptoms.   Thanks! "
Covid,https://connect.mayoclinic.org/discussion/long-covid-neurological-symptoms/,Anyone Found Help/Explanation for Long Covid Neurological Symptoms? ,"Has anyone found some help and explanation for their neurological symptoms? Symptoms like tremors, dizziness, difficulty walking, tingling in legs and back, muscles twitches in legs, hand tremors, cognitive dysfunction, ringing in ears, pain and burning in toes and feet. I have these symptoms and more. I have been through MRI of brain and full spine, peripheral nerve testing, muscle function and short fiber nerve tests all in the normal range despite the symptoms. I have been on 900mg gabapentin daily with little improvement, then things got much worse after getting the booster last month. Would love to hear from some that have found help and explanation.   "
Covid,https://connect.mayoclinic.org/discussion/latest-booster-has-eased-osteoarthritis-symptoms-in-hip-and-knees/,Latest booster has eased osteoarthritis symptoms in hip and knees.,"Same thing happened when I had first (Pfizer) shot.  Have done internet searches as to why this could happen, to no avail.  Does covid vaxx have anti-inflammatory effects?  Last time this happened (first shot) it lasted about four months, so I'm hoping for the same. "
Covid,https://connect.mayoclinic.org/discussion/please-allow-me-to-scream-and-yes-im-crying/,"Please allow me to {{{scream}}}  and yes, I'm crying","I switched to a new PCP as a result of getting nowhere for past 3 yrs and extremely worsening with each and every month and now almost incapacitated and can't even drive.   Like all of us, we need support!  The new PCP basically new nothing, showed her some of my labs and she said it's out of her web of knowledge, but will order some add'l labs; here we go again.   Labs came back showing low B-12 and ferritin (still within normal range but low normal) She sent me to a Hematologist/Oncologist.   Had appt 2 weeks ago.  He walked in the room talking a hundred miles an hour, said he looked at my chart, labs and that I had a ton of work done and seen numerous docs (of course I was referred because no docs can figure it out) wouldn't even look at me to discuss how I'm feeling, my symptoms, examine me. . . nada.  Said you need B-12 injections and iron infusions.  What?  When I tried to ask questions, and share some of symptoms, etc he was already  was walking out of the room.  I tried to tell him my B-12, iron, ferritin were even lower, pre-covid and I felt great, but he wouldn't listen.  Stood up and said, ""my nurse will arrange for it.""  My brother came with me in the room and said he was shocked by his somewhat crazy ""Kramer-like"" demeanor.    Had my first B-12 injection, and of course no change whatsoever, actually worse. So here's where I want to {{{SCREAM}}} after reading his after visit notes.   I have no chance now of getting help anywhere as I am now branded for sure.   To be honest since my last PCP said it's all just anxiety since day 1, I couldn't get anyone to listen or understand.   After visit notes:  (in CAPS are my comments) 
"" She reports having long covid w pain wt loss fatigue palpitations for several yrs.  REPORTS?  IT WAS DOCUMENTED BY MAYO AND AN ENDO.  She has seen various physicians but has not committed to seeing one physician as a PCP over time.  NOt TRUE!  I HAD MY LAST PCP FOR OVER 30 YRS, HE RETIRED AND HAVE BEEN WORKING WITH SAME PCP (who was terrible) SINCE BECOMING ILL FOR THE LAST 3 YRS!   I DECIDED TO LEAVE HIS CARE BECAUSE HE DIDN'T CARE TO HELP WHATSOEVER. I explained for my purposes (she also saw Heme-Onc at MCW which agreed w my following assessment), we can correct her iron and b12.  I discussed AE's from IV iron including infusion reactions.  NEVER DISCUSS REACTIONS.  I'M PROBABLY ADDING FUEL TO MY ALRADY FIRE WITH LT COVID. Of note GI here, Dr G suggested her issues are functional in nature.  She told me he does not believe she is eating what she describes and indeed she has not documented it for him.  He offered a full workup for absorption, also a PEG, but she declined his recommendation/offer for anything earlier this month.  NOT TRUE!  I DID AN ABSORBTION TEST AND DIDN'T SEE ANY SENSE IN REPEATING.  ALSO, DAILY FOOD DIARY KEPT AS WELL AS DOCUMENTED WHEN I WAS IN THE HOSPITAL!  Clearly she has some issues w mental health documented, also her use of various doctors across multiple systems (NW, MCW, Advocate, Froedtert South, Ascension), suggests to some degree problems with reliability, insight, openness to ideas/options and/or secondary gain.  WHAT?  ""mental health issue?*^%%$!    YES, I HAVE ANXIETY, BUT WHO WOULDN'T AFTER SUFFERING 3 YRS AND GETTING NO HELP WHATSOEVER. She declined further Gi eval. I explained IV iron, causes (bleeding absorption issues), start iron b12 now, cbc/ferritin in 2-3 mo.  See me then. I ASKED IF HE FEELS I HAVE LOW IRON DUE TO INTERNAL BLEEDING AND HE SAID NO. I suggest return to tertiary care for various complaints but also suggested better longitudinal care w a PCP to coordinate.   NEVER MENTIONED ANY SUCH THING, SINCE HE REALLY WOULDN'T TALK TO ME. I give up and going into the basemen to scream and cry.  I have nowhere to turn.  This is why when I was down to 89 lbs and went to the hospital they wouldn't help and dismissed me next day.  I'm branded.  All I needed from day 1 was one good, kind and caring MD who would help and if he didn't have answers help me in finding them.  **update** Last few weeks my throat has been hurting when trying to swallow.  Went to Urgent Care fearing Covid again, test was negative.  Now I noticed a red spot on back of throat with a white/cream colored spot in center and neck feels tender.  Last endo said I had lymph nodes.  I called the Oncologist/Hematologist informing them because I want to make sure there is no conflict or danger in getting the iron infusion with this newly formed spot in back of throat and asked the nurse to talk to the doctor, and she said he wouldn't get involved in this and just come in for the infusion.  ALSO, my new labs show low Zinc – hello Covid and immune system, but not one Doc will listen or even cares.   Even when I developed the chalazion below lower lash line, Derm said it's usually due to an immune disorder, I had to have 2 surgeries became it became infected, still there and gets ignored.   How I wish I lived in Madison to go to the ER or Mayo's ER.  Down to 90 lbs scared, sick, alone, shaking and so confused. "
Covid,https://connect.mayoclinic.org/discussion/long-covid-covid-pneumonia/,Dealing with long COVID and COVID pneumonia ,"Hello everyone, so I started feeling sick around dec 16th, self quarantined until the 22nd only to test positive for covid it’s been a rollercoaster since then. I ended up in the er on dec 31st due to shortness of breath, back and chest pain ( I am vaccinated as well) after a chest x ray I was told I had a mild case of covid in my lungs but not to worry so they  sent me home with prednisone, and albuterol inhaler. FF to Jan 8th I woke up and couldn’t take a deep breath with chest and back pain and after using the inhaler and taking a nebulizer treatment and neither worked I ended up back in the er where once again I received a chest x ray, prednisone and ketorolac for pain/inflammation. This time the dr told me that I had pneumonia in my lungs but it was still mild and sent me home with the same scripts as before. I tested positive on the 22nd of dec, the 31st and Jan 6th. Since then I’ve had diarrhea at least twice a week accompanied by slight headaches and my insides are shaky some days. I’m really at a lost and don’t know what to do. Can anyone give me some insight on this please and thank you. "
Covid,https://connect.mayoclinic.org/discussion/bruising-on-armslegs/,Bruising on arms/legs,Anyone POST-Covid AND Moderna vaccinated experiencing bruising in the arms and legs? 
Covid,https://connect.mayoclinic.org/discussion/red-plaque-spots-1-mo-after-having-covid-223/,Red Plaque Spots 1 mo after having  COVID  2/23,"I was just doing some research to see if anyone has reported my symptoms I’ve never had anything like this before so I will blame it on Covid since it came 4 weeks after I had Covid. and I had no problem with the Pfizer two-part vaccine in 4/21. It is non-itchy, but looks bad and starting to take over my body. My MD prescribed some cream but didn’t know what it was. I went to the dermatologist she did a biopsy.. All good except there’s no answer as to what it is I’m supposed to use this cream and It could take months.  "
Covid,https://connect.mayoclinic.org/discussion/what-is-long-covid/,What is long covid?,"1) an auto-immune respose 
2) persistant low-level virus 
3) or what? I heard about a happening soon or now conference in Texas.  Austin?  I need to track that down and follow. I've had long covid since March 2020. That's when I first got the virus anyway.  I felt almost cured in early May this year.  Then the Omicron booster sent me into worse-than-ever relapse, within 72 hours after the shot. Then, a week ago, I started to get dramatically worse. Something was going on beyond just long covid.  I had a covid test, and tested positive for tne virus.  I started taking Paxlovid and immediately improved.  This is day three of Paxlovid.  I am not quite as chipper as I was in early May (right before the Omicron disaster).  But  close. My intuition is (not qutte) science.  However, the dramatic, almost instantaneous improvement made by Paxlovid makes me suspect ""lingering low-level virus"" is a more likely Long Covid cause than anything to do with an auto-immune response. "
Covid,https://connect.mayoclinic.org/discussion/pvcs-after-covid-infection-do-they-go-away/,PVCs after covid infection- Do they go away?,I was infected with Covid in January of 21 and January of 22. Three weeks after my infection I started having pvcs. Has anyone else experienced them? Is there relief? Do they go away?  Two years for me now.   
Covid,https://connect.mayoclinic.org/discussion/any-ideas-how-to-get-taste-smell-back-after-covid/,Any ideas how to get taste & smell back after covid,Any ideas to try after post Covid no taste or smell? PLEASE HELP! 
Covid,https://connect.mayoclinic.org/discussion/post-covid-dizzinessoff-balance-as-most-troubling-symptom/,"Post-Covid dizziness/off-balance, as most troubling symptom","I contracted Covid in December 2021 and am currently dealing with persistent dizziness (off balance, sometimes feels like swaying, rocking, spinning, or a pull to one side). My other most bothersome symptoms are ear ringing, headaches (pressure in the head), feelings of pressure change in my ears, trouble multitasking or thinking, along with developing anxiety/ depression and some elevated heart rate and blood pressure.  Dizziness was not a symptom of my initial infection. I developed dizziness (not BPPV)  around January 15th. I saw a physical therapist who determined I had Vestibular Hypofunction and I began vestibular therapy. It seemed to be working and I even returned to my office job for about 3 weeks, restricted hours. Two weeks ago I began feeling worse again. My physical therapist believes my initial issue has improved – so he doesn't know what's causing my current onset of symptoms. I started an antihistamine to combat any allergy related ear fluid, along with an anxiety medication to try and improve my blood pressure and heart rate.  I'm going to see an ENT next, and hope that I haven't waited too long to try other remedies (if there are any). Has anyone else experienced this overwhelming dizziness and had positive results with treatment or answers as to the cause? I'm scared that this is going to be how I feel forever.  "
Covid,https://connect.mayoclinic.org/discussion/prescription-of-zifaxan-for-abdominal-painpossible-infection/,Prescription of Zifaxan for abdominal pain/possible infection,"I have had long Covid off and on for a year. In the past few months I have developed abdominal pain and bloating, and my bowel movements have changed to a consistently different type. I have hard time eating anything other than spicy proteins, fats and whole grains. I have also gained weight.  CAT scans and stool tests show nothing amiss and my GI doctor suspects an infection which was allowed to developed due to my weakened GI immune system. She has prescribed Zifaxan, which I am starting. Has anyone else encountered these symptoms and/or ben prescribed Zifaxan? "
Covid,https://connect.mayoclinic.org/discussion/has-anyone-found-glutathione-supplement-helps-recover-from-covid/,Has anyone found glutathione supplement helps recover from Covid ,"Someone recommended using liposomal glutathione supplement along with Vit C, D and Zinc to help recovery from Covid. This is my second bout of Covid in 15 months, even though I have been vaccinated however it’s been a year since my last booster.  "
Covid,https://connect.mayoclinic.org/discussion/does-anyone-else-suffer-from-chronic-intermittent-hypoxia/,Does anyone else suffer from chronic intermittent hypoxia? ,I have been dealing with this since Covid in March 2020. It happens pretty much every time upon exertion and quite often at rest as well. I recently flew from Detroit to San Diego and wore my wellue pulse ox ring and I was around 83-85% the entire flight (once we got up in the air). The chronic hypoxia has wreaked havoc on my body and my inflammatory markers are very elevated and my cbc is so abnormal that I had to have a bone marrow biopsy last year ti rule out blood cancer. My hematologist thinks it is reactive due to the hypoxia.  No one knows exactly what is causing it or how to fix it. I am so frustrated. I want my life back.  
Covid,https://connect.mayoclinic.org/discussion/looking-for-exercise-videos/,Looking for breathing and lung strengthening exercise videos,I was on this page several days ago and somehow was led to videos with breathing and lung strengthening exercises. A woman with short grey hair and blue shirt. I don’t remember how I got there. I want to continue these exercises. Anyone know where I need to go. Searches are not getting me there. Thanks. 
Covid,https://connect.mayoclinic.org/discussion/susceptibility-to-stress-and-depression/,Susceptibility to Stress and Depression,"I have had long Covid for over a year, experiencing most of the symptoms noted by the CDC – coming, going, returning, and evolving. Today I experience headaches, tinnitus, abdominal pain, periodic exhaustion, reduced immunity to infections, and major swings in food preferences. Doctors have examined and scanned me from head to toe without finding anything. I am in good physical shape. I have developed coping mechanisms for the physical symptoms, and I am grateful my condition is so mild. But … Typical disagreements with my wife (married 46 years) now cause my symptoms to flare up significantly, as if my tolerance for stress has severely eroded in spite of a long career (now retired) during which I thrived in extremely stressful situations. While my cognitive functions are working well (I study quantum mechanics), my emotions have become more changeable, and I mentally tire faster. I struggle to deal with the welter of mundane adjustments that make a household work. My wife says I am not the positive person I used to be and I am depressed. I feel as if long Covid has reduced my emotional immune system.  To cope so far I listen to humorous media, favorite music, and old shows, and read more uplifting material about humanity and its achievements. I help old friends with far worse ailments and issues than mine. I am going to try adding more daily structure such as improved sleep hygiene and a better diet. I would very much appreciate hearing from others going through similar issues and how they have coped. Many thanks, Jim "
Covid,https://connect.mayoclinic.org/discussion/how-to-stop-the-vibrations/,How to stop the vibrations?,"Anyone have tips on stopping these vibrations? It's been a couple years and they don't let go. Only last about 30 seconds but scares me and I get all saddened and that nobody knows what's going on. I've done MRI's EEG's bloodwork and everything comes back clear. I am glad to have found this forum to know I am not alone,,,  "
Covid,https://connect.mayoclinic.org/discussion/paralysis/,Anyone else experienced periodic episodes of paralysis? Covid related?,"Has anyone else experienced periodic episodes of paralysis? I also have extreme fatigue, muscle weakness, neuropathy, brain fog, problems with word finding, severe headaches and shortness of breath. MRI, CT scan, EMG, nerve conduction studies and labs are all within normal limits. I had COVID in January 2021 and have been out of work on disability since September due to the episodes of paralysis.  I have been to the COVID Recovery Clinic at Nuvance Health and to the Neuromuscular Disease Center at UR Medicine. Nobody has answers or suggestions for treatment. "
Covid,https://connect.mayoclinic.org/discussion/pcs-is-real/,Post-COVID Syndrome is real,"I had covid mid April and have had many PCS symptoms. I seem to be educating my doctors and therapists.  Sometimes it feels like they think I am faking and the next time they tell me they have heard the same thing from others. I am doing everything from aqua therapy, speech therapy for the ""fog"" and still exhausted, headaches, fog and not sleeping well ect. I have used my short term disability at work and working thru my PTO time. I am more than frustrated. Any encouragement? "
Covid,https://connect.mayoclinic.org/discussion/day-21-still-testing-positive/,"Day 21, still testing positive","On 9/11 got sick, stores out of test kits.  On 9/12, test kits in stock, tested positive.  On 9/13 got a script for Paxlovid and started the 5 day regimen.  The only symptoms for the last 10 days are tiredness and some light-headedness.  Some articles I read say if I don't have a fever I'm not contagious, other articles say yes I am and stay isolated until 5 days after testing negative. What is it?  The test kit I'm using is a Flowflex Covid-19 Antigen Home Test.  I'm going stir crazy! "
