disease,postLink,postHeading,postContent
Covid,https://connect.mayoclinic.org/discussion/diagnosed-a-while-ago-with-pots-but-my-bp/,Diagnosed a while ago with POTS but my BP... ,"I was diagnosed with POTS about 8 months ago when at my PCPs, I was dizzy and my face went numb. 180/120.  A quick dose of clonidine brought it down. She didn't put me on any high blood pressure medication, so as an RN, I bought a cuff and started taking it myself. It stayed under whaterever/100 so I just sat on it till I went thru a dizzy spelled again and it was through the roof. I was put on losartan about 6 weeks ago once/day. Within 2 weeks I was on twice a day as it wasn't helping. AM and PM but in the middle of the day it would be really high again, so I was put on clonidine twice a day PRN. And that's where I am right now except it's still really high.  After sitting in my chair for hours yesterday basically doing nothing, it was 180/104 when I went to bed. When I'm taking my evening dose I never know whether to take a PRN at the same time, but I figure it needs to come down fast and if I'm in bed it doesn't matter if my blood pressure a little bit crashes. I'm really quite concerned but I seem to be the only one. ""Take your blood pressure twice a day, write it down, and I'll see you in 6 weeks."" and my PCP (who is an RNP, is actually quite well versed in Long Covid but probably frustrated as there's nothing she can do? So I do a lot of my own research. I just saw a video on YouTube by Dr Mark Hyman about about inflammation and long covid. It's worth watching.  If you do a search on his name  you'll find that video.  It's about an hour long but he mentions a few blood tests that can be done to check for things that aren't being checked for enough. Has to do with small blood clots and inflammation in the veins and arteries. I'm going to check with my PCP when I see her on Wednesday and see if I can get her to order these blood tests and see what's up. Don't we all get tired of everything coming back negative! I get to the doctor in my O2 and my blood pressure fine so I'm glad my blood pressure cuff keeps the reading in memory. I even bought a pulsox that comes with an app so it can be monitored on my phone. It's also worth saying that I've been on overnight oxygen for a 3 years now and I just had to start using oxygen prn during the day. It's not unusual for my oxygen to be in the 80s. I feel like I'm the only one concerned and I feel like long covid is eventually going to kill me. They say POTS  won't kill you but a stroke will. Or if the POTS you have is low blood pressure, if you faint and hit your head,  that will kill you too. I wish people were spending as much money on helping us as they spend ""getting back to normal and opening everything back up"" pretending covid no longer exists. (there's another new variant they're tracking.) I had a really mild case in July of 2020. And I've been sick ever since. I feel like even my friends don't think it's possibly that big a deal. Tired of hearing about it. I feel like my fear of death is real and I'm the only one who's afraid. I'm scared. Is anybody else? I feel like with covid there's three groups. Those who lived, those who died, and those who wish they died? (I am glad to be alive, I'm really afraid to die this way.) I probably should add my mother died of covid in February 2020 before they say it was even here. I know lots of people who say they were very sick in January and February 2020, like ""the sickest they'd ever been in your life.""  I hear people now who say ""I've got the worst cold I've ever had."" I ask if they've tested and they say they are negative. My PCP told me anybody who says ""worst of anything,"" it's covid. I'll add I've had it twice and I've never tested positive. I also have CRPS which is an autoimmune pain disorder and had a huge spread throughout my body as my cytokine level is already naturally elevated. The only thing I keep telling myself is at least I'm 68 and I'm not 35, confined to bed, needing to be carried to the bathroom. I'm seeing people that were very very healthy now being very very sick on the long covid Facebook group. I'm probably depressed as I probably always am but… Medicare won't pay for help in the home unless you need somebody to bathe you. Leave me some dignity huh?  And if you can leave the house and drive to the doctors, then you don't qualify for home assistance. I also go to physical therapy twice a week and very very fortunate to have good insurance. For me, sometimes I've been sleeping on the same sheets for 4 or 6 months. Usually a sink full of dishes and a huge pile of dirty clothes. Kitchen and bathroom floors that have not been washed in a couple years. Life is hard. I'm single, my closest family member 1000 miles away. Even they don't think anything could possibly be serious. They had covid and they are fine. Thanks for listening. I'm feeling very frustrated and very scared right now. And very alone. Keep myself occupied as I actually still run a small graphic design business out of my house.  I'm working on some KDP (Amazon) low content books to sell (coloring books, journals, kids maze books, etc.) If you know computers and looking for something to keep you busy, check YouTube. There's lots of videos about KDP self-publishing. At least it keeps me busy. My best, Betty  "
Covid,https://connect.mayoclinic.org/discussion/post-covid-gastrointestinal-issues/,Post Covid gastrointestinal issues: How long do they last?,Two months out from having Covid.  Gastrointestinal issues still bothering me.  Gas pains throughout mid section.  Dr put me on Pantoprazole last week.  Somewhat better but still experiencing gas pains. 
Covid,https://connect.mayoclinic.org/discussion/does-anyone-else-feel-like-exercising-makes-your-symptoms-worse/,Does anyone else feel like exercising makes your symptoms worse?,"Hi everyone! I have started to have some improvement after starting vagus nerve stimulation therapy and finally felt like I was able to start exercising again! I have a Peloton bike (leaderboard is @stephbea27 if you want to add me!) and I started doing 20 minute rides last week. The first day the ride itself felt amazing and I felt so good while working out, but the next day all of my symptoms were back and I felt terrible. When I take a rest day, I notice the symptoms feel better the next day but when I work out, I just don't feel good the next day. It's like my body is using all of it's energy during the workout and leaves nothing for other processes. Has anyone experienced this? "
Covid,https://connect.mayoclinic.org/discussion/vomiting-liquids-post-covid/,Vomiting liquids post covid,"Anyone else experience daily vomiting post covid? I had Delta variant 8/21 and Omnicron 1/22 and have been vomiting since.  I had a virus in 5/22 and have been unable to keep liquids down since.  I have been on IV hydration for a year.  I have had all the tests done that are available in MT, tried Harborview for 24 stomach emptying but they no longer have the machine?  I have referrals to Mayo but my doctor has been unable to connect with doctor for charity case review.  Any ideas on how to do this? I have recently been diagnosed with POTS but also have malnutrition/malabsorption and vitamin deficiencies.  I need help! Please  "
Covid,https://connect.mayoclinic.org/discussion/newly-diagnosed-complex-migraine-with-aura-post-covid/,newly diagnosed complex migraine with aura post-covid,"Hello – I had an exhaustive workup at Mayo last July after experiencing an episode that seemed like a TIA (transient ischemic attack).  The neurologist finally diagnosed complex migraine with aura.  I am 66 years old and had one more typical migraine when I was 20, and nothing since then.  Since that first episode, I have had four more, and each has varied slightly in nature but all have been quite disturbing in that I often have a period where I slur my words, and then the actual migraine is followed by 2-7 days of brain fog that is distressing.  My Mayo neurologist did not suggest any medication, but I did connect with a local neurologist who suggested I try Nurtec, which is taken at the first symptom and can work for my type of migraine.  Medicare does not pay for it.  I broke down and bought an 8-pack, at $100/pill, and keep one with me always.  Since getting the med, I did have one migraine but it was the middle of the night and I was so out of it that I didn't think to take the pill until I was well into the episode.   The pulmonologist did determine that I had had covid, due to signs he saw on my lung CT.  I have come to the conclusion that my sudden onset of migraine is connected to the covid.  Anyone else out there with a similar story? "
Covid,https://connect.mayoclinic.org/discussion/post-covid-cough/,What remedies help with post Covid cough?,"I'm three to four weeks past COVID and still have cough (during the day)  I sleep ok without coughing.  Lungs seem to be clear, the cough is more bronchial producing expectorant.  Cough remedies (except honey) don't seem to work. "
Covid,https://connect.mayoclinic.org/discussion/dental-pain-after-getting-covid-no-heatcold-sensitivity-just-pain/,"Dental pain after getting covid? No heat/cold sensitivity, just pain","I went to the dentist today for 6 mo checkup, and the teeth cleaning was agony. Pre-covid there wasn't much pain but now it feels like nerve roots are being hit. No sensitivity to heat/cold. I got covid in early March and still have some fatigue/chest pain. I haven't noticed elevated pain signals anywhere else, but I did have swollen/bloody gums for the first month after covid.  "
Covid,https://connect.mayoclinic.org/discussion/i-am-trying-to-get-into-mayo-for-long-covid/,I am trying to get into Mayo for Long Covid   ,"I am trying to get into Mayo for long Covid since infection 10/20. Now I’m being told had to have had Covid in last 90 days or within 2 years. I tried to get in last year and was told I couldn’t go there due to where I live in WI. I am so unbelievably frustrated!!! I thought Mayo was supposed to help people when all other avenues have been exhausted?? I’ve seen all the specialists, had all the tests, done different therapies, paid out of pocket for a long Covid clinic near me.   Any ideas or suggestions? "
Covid,https://connect.mayoclinic.org/discussion/brain-changes-from-long-haulers/,Do other long haulers suffer with brain changes? Seen any improvement?,"Hi there, 
I am new to the site and have been recommended by my Dr to reach out. I had covid19 in November, I still struggle with fatigue, body aches, shortness of breath, racing heart and cognitive brain changes which have turned my world upside down. Does any one suffer with brain changes? and have you seen improvement over time? "
Covid,https://connect.mayoclinic.org/discussion/buzzing-feeling-in-head/,Buzzing feeling in head,Has anyone experienced buzzing feeling in their head when they lie down (especialy at night? I have had long Covid 16 months and this is a new synonym  for me.  
Covid,https://connect.mayoclinic.org/discussion/i-am-finally-giving-up-covid-can-have-me/,I am finally giving up COVID can have me,"After now being 7 plus months of being tortured, over looked, and passed up. I am here to tell you all I am done trying. The pain of rejection hurts more than the pain left behind from Covid. All I wanted when I tried to make contact with the Mayo Clinic was for a doctor with a little knowledge of what is happening with me to just speak with me, but nope. I was sent a email stating there's no resources for me they were sorry to inform me my application was closed. That is it besides you can't contact this email. No reply!!! 
I reached out to everyone and everywhere I could and nobody and I mean nobody responded. Except for the normal I will pray for you, called me a drug addict ( I don't take meds even so how is that), lie to me and lastly there is not one red care in this world for me. So I am here to say  Thanks for nothing folks. I am done if I die nobody is going to care. I bet not one person has even read this message.  "
Covid,https://connect.mayoclinic.org/discussion/new-approach-to-managing-for-life-with-longhaulers/,New Approach to Managing for life with Longhaulers ,"I’ve been recovering and discovering for almost 3 years.  Personally I manage my Longhaul with the Whoop to Avoid the Push and Crash.  The latest think I’ve learned about is this article. 
 
I recently underwent lactate testing during with exercise.  I struggled so much.. My break throughs were accomplished with: The Whoop The PRC clinic at Mayo The Longhaul Hyperbaric Protocol at AVIV It seems this is the final break threw.  Understand the metabolic disorder that remains with activity.  If you need help and resources. I’m happy to share.  We all share the same uncertainty and confusion. But it does get better. It just takes time. You are not alone..  You will recover.. Hugs.  For more information you can look up extra free content under #covidrecoverymama Longhaulers is a spectrum disorder.  Understand the trauma COVID caused.  Be Well and Never Give Up.  "
Covid,https://connect.mayoclinic.org/discussion/no-appetite-for-months-suddenly-now-i-am-famished/,"No appetite for months, suddenly now I am famished  ","I lost 32 pounds since fall of 2022. 
No appetite….idea of eating sometimes even made me nauseous.  Then 2wks ago I totally reversed and am famished 24/7.  Gaining weight rapidly. What is going on? "
Covid,https://connect.mayoclinic.org/discussion/does-anyone-have-this-particular-gi-symptoms-post-covid/,Does anyone have this particular GI symptoms post COVID? ,"Hi – I had COVID in June 22 and been having lots of issues since: dizziness, fatigue, brain fog… but the most bothersome has been lingering GI symptoms. They have been getting better over time but I still get these episodes- they used to be every 2 weeks, now its more every two months – of severe abdominal pain it used to be my stomach but now it is more my intestines – like pain, gas, inflammation and nausea, but no diarrea and no vomiting. I also feel very weak, almost dizzy and the second or third day I develop a severe headache. About three to four days aftetr I am back to ""normal"" which is not exactly normal but I can function. I am on probiotics, pantoprazole (these two help) and excluding gluten, dairy and eggs from diet – not sure if this is helping, though, as is based on one of those non-evidence based IGG ""intolerance"" tests, but I was willing to try anything I guess. Does anyone has similar episodic GI symptoms? Drs dont say much, they just want to do colonoscopy to rule out other things, but I dont see the point as it seems no one with long COVID shows anything wrong in these tests so why take the risk…   "
Covid,https://connect.mayoclinic.org/discussion/how-many-had-vacs-before-long-covid/,How many had VAC's before long covid,"I would like to know of those suffering from LONG covid how many have had the vaccinations before getting covid. 
I had covid twice but never vacced. "
Covid,https://connect.mayoclinic.org/discussion/post-covid-brain-issues/,Post Covid Brain Issues,"I had Covid in November 2020, a severe headache, different from any previous headaches in December. A CT of my brain at that time was negative. I began having cognitive problems with memory, math and dates & times. A June MRI of my brain showed bilateral chronic frontal temporoparietal subdural hematomas. Has anyone else experienced this? I’m wondering if this is something that will continue to happen? "
Covid,https://connect.mayoclinic.org/discussion/anyone-still-cant-smell-or-taste-certain-things/,Anyone still can’t smell or taste certain things??? ,I had covid two years ago and I still have the issues of not smelling or tasting certain items how about y’all?? 
Covid,https://connect.mayoclinic.org/discussion/post-exertional-malaise/,Post Exertional Malaise,What can help Post Exertional Malaise crashes that is common with Long Covid same as with  ME/CFS?  
Covid,https://connect.mayoclinic.org/discussion/is-anyone-taking-amantadine-for-brain-fog/,Is anyone taking amantadine for brain fog?,I have been taking it for 2 months and am gradually getting a little better. My RX is for 3 months. I saw a side effect is melanoma and am concerned.  
Covid,https://connect.mayoclinic.org/discussion/covid-and-complex-regional-pain-syndrome/,Dealing with Post COVID and Complex Regional Pain Syndrome ,I was fully vaccinated in May with Moderna. I was diagnosed with Covid during the Delta spike in July. I was diagnosed with Reflex Sympathetic Dystrophy now called Complex Regional Pain Syndrome in 2003. I am dealing with long Covid now and possibly a flair up of CRPS. Anyone else have both? Did Covid cause your CRPS to flair? I was already having trouble finding a Dr. for the CRPS but forget about finding one who will take both seriously.  
Covid,https://connect.mayoclinic.org/discussion/low-dose-naltrexone-for-post-covid-recovery-experiences/,Low dose naltrexone for Post-Covid Recovery experiences ?,"Does anyone have experiences with low dose naltrexone for long Covid symptoms of significant brain fog, post-exertional fatigue, joint pain, muscle pain – inflammation, insomnia. A few studies in late 2022 indicate that low dose naltrexone 4.5 mg is helpful . Do you know of a specific doctor in NYC who prescribes it?  "
Covid,https://connect.mayoclinic.org/discussion/swollen-lymphnode-in-neck/,How Long did it take for Swollen Lymph Nodes in Neck to go Down?,"How long did it take for swollen lymphnodes in your neck to go down post covid? Mine have been swollen on one side for 2 1/2 months. ENT doesn't seem concerned. Sometimes it is painful, and sometimes I have difficulty swallowing. What did you do to make yours better?  "
Covid,https://connect.mayoclinic.org/discussion/what-to-use-for-anxiety-with-higher-heart-rate-and-a-sensitive-body/,What to use for anxiety with higher heart rate and a sensitive body. ,What can I take for anxiety that has low side affects? My body is very sensitive and my heart rate has been affected by being higher than usual. Also have had some palpitations. Tightening in throat. I am only 100 pounds.  
Covid,https://connect.mayoclinic.org/discussion/nosebleeds-during-this-covid-variant/,Severe sinus infection and nosebleeds with this covid variant ,"this is the second time I caught covid in 90 days. Severe sinus infection, headache and nose bleeds, have to get nose cauterized. 
has anyone have this "
Covid,https://connect.mayoclinic.org/discussion/anyone-develop-worsened-acid-reflux-gerd-or-a-hernia-post-covid/,Anyone develop worsened acid reflux ( GERD ) or a hernia post-covid?,"My husband always had bad acid reflux issues and I had mild acid reflux.  After covid, his acid reflux became so bad that he had to get surgery for that and for a new hernia.  I also found out that I had developed a hernia post-covid and my acid reflux is now worse as a result.  Doctor said that the excessive coughing and vomiting can cause a hernia. "
Covid,https://connect.mayoclinic.org/discussion/low-dose-naltrexon-helping-alot/,Low dose Naltrexone for POTS helping alot,"Hello all. Hope lots of you are getting better. 
My son has/had POTS. I put him on LDN and he is so much better. So wonderful to see – finally! And there are no side effects. 
I think it´s also worth trying although the symtoms are other than POTS. 
LDN is not evidence based yet, as is the case with any other medication. But the way I see it is: What ever works. 
B.w. and take care. "
Covid,https://connect.mayoclinic.org/discussion/reactions-of-others-to-your-long-covid/,Reactions of others to your long Covid,"I've recently realize that I have long Covid, with most pronounced symptoms shortness of breath with exertion and GI problems.   As any of you have let other people know about this condition do you find that they become overly worried about the possibility that you are contagious?  I know that I am not, but I wonder whether other people will be anxious, or have the belief that I'm posing a hazard to them in situations like this:  sitting in a crafting group for several hours; going to a church meeting for an hour or two.   I'd appreciate hearing about anyone's experience with this. Thanks! "
Covid,https://connect.mayoclinic.org/discussion/experiencing-delayed-post-covid-fatigue-shakes-and-overwhelming-anxiet/,Experiencing delayed post Covid fatigue shakes and overwhelming anxiet,"Has anyone else had onset months after Covid of debilitating fatigue, shakes, accompanied by extreme waves of emotional distress, like your brain has been altered? "
Covid,https://connect.mayoclinic.org/discussion/has-anyone-been-following-gez-medinger-on-youtube/,Has anyone been following Gez Medinger on YouTube?,I recently found Gez Medinger on YouTube who has been hosting various people to discuss Long Covid for quite awhile.  The latest research he has found as to what caused Long Covid is 'Microcloting and the Acid-Base Disruption Hypothesis'.  I find the research quite interesting…esp. the acid-base theory.  Just thought I would pass a link along… You can search for Gez Medinger on YouTube for additional topics on Long Covid. 
Covid,https://connect.mayoclinic.org/discussion/how-long-do-you-sleep-every-daynight/,How long do you sleep every day/night?,How long do you sleep every day/night? I've had Long Covid for almost 3 years and I'm still sleeping up to 15 hours a day!  All I can say is that I'm so grateful that I'm retired and I have 2 wonderful cats that likes to sleep with me that much! 
Covid,https://connect.mayoclinic.org/discussion/anyone-with-long-covid-have-trouble-with-bone-healing/,Anyone with Long COVID have trouble with bone healing?,"Anyone with Long COVID have trouble with bone healing?   Husband’s bone has healed in over 2-1/2 years due to Long COVID’s central sensitization system’s “fight or flight” response. BACKGROUND STORY  (or skip ahead to last paragraph) 
My husband was initially infected with COVID in March 2020.  He spent the next 9-mo in bed 18-hours a day.  We “followed the symptoms” which led us to see a cardiologist.  My husband ended up having a quadruple bypass/graft (CABG) at the age of 52 in February 2021.  His sternum, however, never healed back together.  He followed doctors orders, yet months after surgery, he was in continuous pain.  Nine months after surgery, he had a CT scan that showed, an unstable, non-union of his sternum with at least 3 broken wires.   His sternum was separated by almost a centimeter!  One side was also projected out further than the other.  He was a mess.  He was told not to drive, not to hold anything heavier than a gallon of milk.  With the instability of his sternum and the fact that scar tissue was adhered to his LIMA graft, doctors were afraid it could be catastrophic if he were to fall, for example.  He needed to have his chest reopened and repaired.  We found a cardiothoracic surgeon who had years of successful experience with titanium plates for “younger” open heart surgery patients, so just about a year after his initial surgery, he had a sternotomy.  The surgeon removed the broken wires, scar tissue, debrided the edges of his bone and used 4 titanium plates and wires to put him back together.  We were told his bone would be completely healed in 12-weeks. Fast forward 16-weeks later, after pain and problems, a CT scan revealed, the sternum hadn’t even started to mend!  There was no  bone growth.   Fast forward almost 1-1/2 years from the second surgery, there still has been no bone growth.  His surgeon was dumbfounded.  We went to see Cardiologists, Endocrinologists, Infectious Disease doctors, other specialists in the medical field, even naturalists, etc.  Nobody has a clue why his bone wouldn’t heal.  We asked everyone if they thought it was COVID related, and they all said a resounding, “no”.  They said there was no precedent, no evidence, no whatever…. During that time, we were able to have one of the doctor’s provide a referral for in-network benefits to Mayo Clinic in Rochester, MN.   The request was approved for 6-visits, so we applied to have my husband seen at the Mayo’s Long Covid clinic.   After all this time with no answers from a variety of highly-educated, well-meaning doctors and specialists, it was during an initial virtual consult with the Mayo long COVID clinic that we were told that LONG COVID WAS THE REASON MY HUSBAND’S STERNUM WOULDN’T HEAL!   His central sensitization system was turned on when he had COVID, and for some reason, it has not turned off.  So essentially, he was in a perpetual FIGHT OR FLIGHT struggle, which contributes to a lot of the fatigue and other issues people have with LC, but it also says to my husband’s body, “hey buddy, you are in danger right now,  so your bone is going to have to wait to heal until you’re safe…”.  And since that fight or flight switch hasn’t turned off  on it’s own, he continues to suffer not only the other debilitating symptoms of Long COVID, but also the pain, clicking, popping, and restrictions associated with a non-healing sternum.  His life pretty much sucks, and as a result, so does the rest of our family.  If anyone else has had issues with bone healing, we’d like to know.  We are trying to get support from our insurance company to pay for him to continue working with the Mayo LC clinic, but they have denied multiple requests.   Fighting with the insurance company can be overwhelming to an already grueling, lonely journey of living with Long COVID. Thank you. "
