disease,postLink,postHeading,postContent
Covid,https://connect.mayoclinic.org/discussion/anaphylaxis/,Exercise-Induced Anaphylaxis?,"I’m a healthy 69 yr old male. I got COVID in February of 2020. Since that time I’ve become almost totally disabled with what appears to be exsersize induced anaphylaxis. On level ground I do very well, stairs not good. Using my upper body not good, bending over is not good. I have several symptoms of Dysautonomia. What happens is my heart rate will hit 132 bpm, BP 80/70 and I can’t breathe! It is life threatening and no Doctor wants to see me anymore. I was prescribed an epipen. Next time I’m using it, very sorry I didn’t two nights ago. I pray no one else has this. "
Covid,https://connect.mayoclinic.org/discussion/any-benefits-to-taking-prednisone-5-mg-for-long-covid-symptoms/,Any benefits to taking prednisone 5 mg for long Covid symptoms ?,"An immunologist in NYC who works with long Covid patients prescribed prednisone 5 mg for my long Covid 19 symptoms: brain fog, fatigue , joint and muscle pain. I am already on low dose naltrexone (LDN), aspirin 84 mg and statin Lipitor 10mg. She said that all of those drugs can be helpful to address , micro blood clots, chronic inflammation associated with long Covid. Does anyone have experiences with using prednisone 5 mg daily?  She also mentioned antivirals like Paxlovid , but stated that there were side effects. A few people on the forum mentioned Adderal for fatigue ? Comments and thoughts greatly appreciated !  "
Covid,https://connect.mayoclinic.org/discussion/has-anyone-tried-creatine-for-post-covid-fatigue/,Has anyone tried creatine for post covid fatigue?,I read an article recently about taking creatine to help with post covid fatigue. I was wondering if anyone here has tried it.  
Covid,https://connect.mayoclinic.org/discussion/treatment-ideas/,Post-COVID Treatment Ideas,"Acupuncture Naproxine ( for inflamation) Fish Oil Omega-3/ 1400 mg EPA/480 mg DHA( for brain) Folic Acid ( for brain) apps – cog pt ( iphone/ipad), Lumocity, play / learn sudoku/chess meditation apps ( calm, headspace, waking up/sam harris) excercise ( swimming / biking/community) sleep ( check if you have apnea) modafinil ( brain) Cvac TMS *these are things I’m experimenting with and are in no way absolutes for anyone. Try at your own risk and comfort. "
Covid,https://connect.mayoclinic.org/discussion/covid-tremors-and-covid-vibrations-support-group-and-myoclonus-jerks/,Covid Tremors and Covid Vibrations support group and Myoclonus (jerks),"Is there any treatment for Covid Tremors and Covid Vibrations and Myoclonus (sudden muscle jerks)? My wife first got Covid in June of 2022, then in January of 2023  she got worse every day. Her fatigue got so bad she was in a wheelchair and one or two days away from going and probably not returning from the hospital. BUT, we found LDN (low dose naltrexone) and had an immediate good response for her fatigue (she is still very fatigued) 
However, the Covid Tremors and Covid Vibrations and Myoclonus (sudden muscle jerks) have not gotten better and at times gotten worse. Her hand will travel 12 or more inches during her tremors. She can not eat or drink while she is in this state. If these tremors get worse, she will not be able to eat or drink and we all know how that ends. 
She needs HELP 
our PC has sent a referral to Mayo in Phonix, I pray Mayo will accept her.  PLEASE HELP "
Covid,https://connect.mayoclinic.org/discussion/lung-nodules-post-covid/,Lung nodules post covid,"I just found out I have 2 lung nodules plus a few micro nodules in my upper left lung, don’t believe they are malignant . I went into the Dr for severe weakness and fatigue. My last bout with COViD was 2/2022. I have not smoked since 1974 and I don’t have a history of lung issues in my family. These nodules are new soft tissue since my last X-ray 2/2022. Anyone else experiencing this? "
Covid,https://connect.mayoclinic.org/discussion/latest-update-statin-for-covid/,**latest update** - Statin for Covid,"I thought this info would be helpful since we NEED to keep in the know and whatever we can do for support in helping one another. Since we now know Covid attacks are blood cells and is no longer a ""lung"" issue as originally thought, I came across some info on Gov site, immune and disease specialist's site as well as doctors reports that taking a Statin drug prevents severe Covid and hospitalization.   Oddly enough, between my friends, colleagues, neighbors and family who are on a statin drug, did NOT catch Covid, to include my brother who was in a household with folk who had Covid!  Per the report, since Covid causes severe inflammation in our body due to the virus attaching itself and attack our blood, the statin is preventing Covid from going rampant and attacking our blood cells.  I'm curious, how many folks on this site are on a statin?  I'm guessing not many and those that are won't be on this site because they either recovered just fine or never got Covid.  "
Covid,https://connect.mayoclinic.org/discussion/inner-ear-pressure-motion-sickness-fatigue/,"Inner ear pressure, motion sickness, fatigue ","Hi, all!  It’s been so helpful seeing that it’s not just me still dealing with issues after Covid. I tested positive on December 31 of last year. My struggles have been with fatigue (like everyone else), low blood pressure, inner ear pressure & motion sickness. I was on antibiotics & nasal sprays for the ear pressure which were no help. Finally decided to try vestibular physical therapy. My therapist was amazing. While it didn’t relieve the ear pressure, she helped me be able to ride in a car longer than 5 minutes without feeling nauseated. My ear issue was not vertigo. It’s so hard getting others to understand that. The pressure worsens the more fatigued I am experiencing. It’s also makes my hearing worse. Doctors are at a loss as how to help. Fatigue is a battle. I’ll feel fine and participate in some type of activity then suffer for a couple of days with fatigue. I try to listen to my body & not overdue but . . . it’s hard. My husband & I retired shortly before I got Covid.  We’d like to do activities. I try but suffer afterwards. Fatigue is a beast. People don’t understand that while I may look & sound fine, fatigue is my constant companion. I do walk each morning which I need to do for my mental well being. I lost some weight. It’s slowly coming back. Had a stretch where I had low blood pressure. It was in the 80/50 range. It’s come back up most days to a more normal level. My doctor lowered the beta blocker I was on for migraines. You can imagine what has happened since. Yes, my migraines are slowly coming back. Yuk! My PCP referred me to the University of Florida’s long Covid treatment program. Earliest appointment I could get is mid September. One day at a time. Such an awful experience!!  "
Covid,https://connect.mayoclinic.org/discussion/recommendations-on-specific-clinics-for-long-covid/,Recommendations on specific clinics for long COVID,"I am totally frustrated with the options for getting treated for Long COVID.  I have been unable to basically walk since Jan. 2021 and have tried everything I can think of to improve with no help.  I know long COVID is a new disease and there is not much known about it, but I am  ready to try anything.  I tried getting many, many tests, a ton of physical therapy and nothing has helped.  I think it has to do with my inner ear and when I get stuffed up, my balance gets even worse.  Any suggestions and specific recommendations on doctor or clinics to try??? "
Covid,https://connect.mayoclinic.org/discussion/post-covid-head-pressure-dizziness/,Post Covid Head Pressure/ Dizziness,"I am new here, I had covid last year, I have not been the same since, I feel like I am dizzy often, I have head tightness and pressure, some times stabbing pain in my temples. Feels like vertigo at night when I am just sitting there. its horrible, I had had 2 cat scans of my head, nothing came up. I really believe this is from Covid.  "
Covid,https://connect.mayoclinic.org/discussion/any-folks-receive-rx-during-covid/,Any folks receive Rx during Covid?,"I am suffering so severely and besides all unbearable symptoms, yesterday another terrible new symptom appeared. . . burning throat and burning mouth syndrome.  It's agonizing.  I can't take this.  I've already lost so much weight and down to 90 lbs and now because of all the burning it's hard to even eat or swallow. Just curious, if any folks who are suffering from Long Term were given medication?   Whether it be, monoclonal antibodies, or other medications? I was not given anything, and Doc said, 'I'll be fine,"" and I'm so angry that I could have prevented all this 3 yrs of suffering if only he treated me properly.  It helps us to know if there's a way to address it properly and we can help others as well.  "
Covid,https://connect.mayoclinic.org/discussion/anyone-try-antihistamines-for-treatment-looks-to-be-very-successful/,Anyone try Antihistamines for treatment?  Looks to be very successful,"I came across this article after viewing the most thorough explanation I have ever read about LT Covid, what it does to our body, and why some folks develop LT  Covid/  Video is by Dr. Mark Hyman (so knowledgeable) and Dr Leo Galland, M.D (a genius!)   Further below I included that link as well.   After viewing, you will more than likely walk away saying OMG.  Of course, antihistamine treatment is just one protocol and as we all know, we require several therapies modules. 
 
Here's a link for Dr. Galland's research and treatment plan.  Quite overwhelming. 
 "
Covid,https://connect.mayoclinic.org/discussion/new-study-on-impact-of-long-covid-on-employment-disability-and-more/,"New Study on Impact of Long COVID on employment, disability and more","Do you want to add to the body of credible research being done on the financial impact of living with Long COVID? Please consider filling out Katie’s brief survey: 
NEW ✨Long Covid patient experience survey. If you have #longcovid, please consider taking this ~10 min survey about your experience with employment, disability, & more. I will publish findings at Brookings, and in a journal article. Survey link: brookingsi.qualtrics.com/jfe/form/SV_2a……  "
Covid,https://connect.mayoclinic.org/discussion/anyone-experience-changes-in-your-menstrual-cycle/,Anyone experience changes in your menstrual cycle?,"My menstrual cycle was regular prior to my covid vaccine.  Now it is all over the place and recent blood work put me in the post menopausal range despite still getting a period (whenever it decides to show up).  Please tell me your story, testing done and successful treatments you've had. Thanks "
Covid,https://connect.mayoclinic.org/discussion/shingles-shot-helped-or-hurt-long-covid-symptoms/,Shingles shot: helped or hurt long covid symptoms?,"Greetings, 16 months of long covid, I am interested in getting the two shot shingles vaccine, but worried about aggravating PASC symptoms given the reaction that some people have from the shot. Have you had the shot? Made things better, worse or neither? Thank you! Greg  "
Covid,https://connect.mayoclinic.org/discussion/is-anyone-unable-to-stand-in-one-spot-without-getting-exhausted/,Is anyone unable to stand in one spot without getting exhausted?,"Since post Covid, one of my horrible symptoms is I cannot stand in one place more than a minute (sometimes less-it varies on the day) without feeling EXTREME fatigue in my body/legs, short of breath, dizzy.  It’s impossible for me to do without hurrying and laying or sitting down.  Weird thing is that I can walk but as soon as I stop walking and am still in one spot, I feel like I’m dying. 
Has anyone experienced this?  "
Covid,https://connect.mayoclinic.org/discussion/finally-going-to-see-primary-doctor-long-covid/,Finally going to see primary doctor (Long Covid),"Finished TMS treatment for depression and only help i have noticed is my sleep. 
Long story short i have always had depression and zoloft worked for 20+ yrs until i got covid in January and may have had it before and not known it. 
My symptoms were just sneezing and runny nose. 
I now have been suffering with anxiety which i have never had in my life along with terrible fatigue…I am always tired and if i do anything physical i breathe heavy. 
My Meds doc at the TMS and mental health center wants me to see primary care doctor to rule out other issues. 
He has switched me from viibryd to 200 mg of luvox at bed time for ocd ( ruminating thoughts)…I still take Klonopin 0.5mg at night and as needed otherwise for anxiety. 
My anxiety can come up at anytime for no reason and no triggers. 
He thinks i may have long covid and says he sees a couple long covid patients. 
My question is…How do i approach my primary care doctor besides telling him the obvious? 
If all my bloodwork and tests come back fine…Then what? 
Who actually can diagnose you with long covid and how is it treated? 
This cronic fatigue and anxiety has made life miserable and i am a shell of my once self. 
I can function but only just enough to barely get by every day. 
It is beating me down more every day. 
Thanks "
Covid,https://connect.mayoclinic.org/discussion/muscle-pain-where-my-kidneys-are/,Muscle Pain where my kidneys are,"I had COVIDin November. In the 3rd week of November I started getting severe pain in my back on the right where my kidney is. We thought I had a kidney stone. Went to ER’s nothing. Had 2 CAT-scans- nothing! Doctor wanted to give me Valium!! The PA at the other ER told me to do Yoga!! I can’t get any help. My Primary doctor wanted me to take anti depressants & anxiety pills! 
I now have the same pain on the left side. So now I have it on both sides. It comes & goes. Very sharp pains to where I want to pass out. I need help. Is anyone else suffering severe muscle pain??? "
Covid,https://connect.mayoclinic.org/discussion/post-covid-for-21-months-now-and-still-declining/,Post COVID for 21 months now and still declining,"Hello, 
I'm a mid-40s male in good health (or was). I contracted COVID in Oct 2020 and never recovered from it. I had what they called a ""mild"" case where my blood oxygen level didn't drop below 90% and I wasn't hospitalized. I had a fever for about two weeks, migraines, and numerous varying symptoms over that period of isolation. Once I finally got out of isolation, I still encountered heavy fatigue, muscle weakness, and heavy inflammation. I teach computer science and cybersecurity at a small university and consult on the side. I was missing 2-3 days of class a week due to an inability to function well enough to lecture. I was sent to the ER twice, once due to possible stroke and again for a kidney stone (never had one before in my life). I was vaccinated in the Spring of 2021 because the stories of it improving Long COVID suffering, it didn't. A couple months later in June, I started to relapse badly, and have been slowly declining since. I had to withdraw from my doctorate program because I was unable to keep up with the work as I struggle to keep a thought for more than a couple minutes. This is also impacting lesson planning, lecturing, consulting, etc.  Currently, I am struggling to move very far physically. I try to walk for 20 min a couple times a week, but it takes 2-3 days to recover from it. My body is constantly in pain from the inflammation (6 or 7 on a scale of 1-10), with spikes from time to time. I struggle to walk, type, or perform many activities. High temperatures amplify the pain and weakness, so this summer has been far from relaxing. I've had to use a cane to walk, but my grip and arm strength is not good, so it's not much of a benefit. I'm used to working 8-10hrs a day and right now am lucky to get 2-4hrs in a day. I'm the sole source of income for my family so I can't just stop and rest until better. I've been visiting the Vanderbilt Adult Post-Acute COVID clinic for over a year now. We've tried many different treatments, mostly wholistic focused, but with minimal success. All the treatments that have worked for other patients in the program have not shown noticeable improvements for me. I'm running out of ideas for things to try. I have to resume teaching in a month and I'm not sure how I'm going to survive the semester in my current state.  I'm on a base set of a good pro-biotic, Vit B complex, Vit C, Vit D, baby aspirin, one or two other supplements.  I've tried PEA supplements, NMN supplements, Cortisol managers, and others. We tried a common steroid to try and alleviate some of the pain from inflammation, but it didn't prove any benefit, only major side effects. Any ideas of things that may help are welcome. "
Covid,https://connect.mayoclinic.org/discussion/post-covid-flair-up-monthly/,Post covid flair up monthly ,"I got covid in October 2021 and had my first vaccine January 1rst this is when symptoms started have I now have dystolic heart failure on one side and congestive heart failure on the other.  I also have some shortness of breath, fatigue and brain fog i can deal with this but If I do too much I get a flare up with extreme fatigue body aches, not feeling good, and worsening brain fog.  Does anyone have this?  I did covid for the second time in May not mild either.  Since then I feel like things have gotten worse and I have depression but feel that is worse also so my Dr upped my med after being on the same dose for years.  I feel like I was given a life sentence of this with no hope in sight… "
Covid,https://connect.mayoclinic.org/discussion/post-covid-cough-cant-havent-been-back-to-work/,Post Covid: Still coughing and worried about going back to work,Still coughing and worried doctor won't sing off on my leave. Any advice would be greatly appreciated.  
Covid,https://connect.mayoclinic.org/discussion/dealing-with-post-covid/,"Dealing with Post Covid making depression worse, anyone else?","I have had many boughts with anxiety, sometimes feeling like I'm going nuts.  I am BiPolar so struggle as it is.  Being in pain all the time, not sleeping, missing out on Holidays and Birthdays has made my depression so much worse.  I ended up having a first time episode of what's called Auditory Hallucinating.  It's hearing sounds like music from a radio without a radio playing.  It's rare according to what I have found online.  It happened after two nights of no sleep in pain.  Has anyone else had problems you've never had to deal with since having Covid?  I also write on the Post Covid board as well. "
Covid,https://connect.mayoclinic.org/discussion/spontaneous-nose-bleeds-with-this-covid-variant/,SPONTANEOUS NOSE BLEEDS WITH THIS COVID VARIANT,"I CAUGHT COVID TWICE IN 90 DAYS, THIS TIME I HAVE SPONTANEOUS NOSE BLEEDS. I HAD NOSE CAUTERIZED, BUT ONCE/TWICE A WEEK  I COULD JUST BE SITTING WATCHING TV, AND HAVE A HEAVY NOSEBLEEDS.  ANYONE HAVE THIS TROUBLE. "
Covid,https://connect.mayoclinic.org/discussion/post-covid-19-and-pulmonary-fibrosis/,Post Covid 19 and Pulmonary Fibrosis,"I had Covid-19 about 18 months ago and spent 15 days in the Hospital. I was sent home on ~4 L/min oxygen therapy. I have had a host of issues from Long Covid and have been able to work thru them in various ways that have made them better or eliminated them. I first learned how to walk again and using various therapies, rehabilitations, and determination, I was able to wean off oxygen therapy after 9 months. The main battle for me now is Lung Fibrosis. I have it througout both lungs especially in the lower lobes. The Pathology on both CT scans states that, and possible UIP.  My Dr wants to start me on OFEV but the second CT scan stated ""fibrosis  was stable""? I asked my Dr if my fibrosis was worsening and he said he wasn't sure?  I would like any information or experiences anyone has with Pulminary Fibrosis as it  relates to Covid-19 and any treatments or therapies that might have been done to improve lung function and quality of life. Thanks! "
Covid,https://connect.mayoclinic.org/discussion/looking-for-hope-in-a-time-of-trauma/,Looking for Hope in a time of trauma. ,"I Just came from the ER. When I tell you it was the worst experience I have ever had. Nobody listens to me when I try to explain what was going on. They didn't do full exams and gave me no answers but I have 3 mass. One in my breast, one in my rectum and one in my colon. Gave meds I already told them I can't take because I just throw it up. I guess tomorrow is another day can only hope for the best. I am down now 44 lbs in 35 days. I have been suffering for over 6 months since I had Covid and there doesn't to seem be any relief for me any time soon. We do not have Doctors where I live so I have to go an hour away just to here nothing. I will have to pay $10k for nothing.  "
Covid,https://connect.mayoclinic.org/discussion/sob-with-shoulder-pt/,Shortness of Breath with Shoulder PT,"I had COVID in August 2020.  I have been gradually improving.  My SOB with exertion has gotten better, allowing me to walk at a slow pace for 20 minutes and then, 20 minute recovery.  I thought I was over the major SOB with exertion resulting in dizziness, etc. until today.  I was at PT and am in the 10th week of shoulder surgery recovery.  Today was much more strenuous resulting in one of my former significant SOB experiences.  So discouraged and I have to continue if I want my shoulder to be totally rehabilitated.  Any similar stories and/or suggestions?  Thank you.  Lucy "
Covid,https://connect.mayoclinic.org/discussion/ayurveda/,Ayurveda ,"Hello everyone. So I had covid three times last year, possibly four but one time was negative test. I developed severe acid reflux ( I have hashimotos which can also cause reflux and can also be triggered by EBV, and while I’ve had reflux it got much worse after covid) 
I suspected I had SIBO and my doctor was willing to give me a two week trial of cipro. Because I also suspected the possibility of h pylori I took a dose of pepto bismol daily in addition to pre and probiotics. 
This helped significantly with my reflux though I still had some minor issues. 
I still suffered from extreme fatigue and muscle weakness, which is common with hashimotos but much worse after covid. 
I decided to look into some Ayurvedic medicine and a week ago started ashwagandha and black seed oil. Both have amazing benefits and there’s a link between Long Covid and EBV, and EBV is considered a factor in hashimotos too. 
I also added Maca and oil of oregano. Oil of oregano can help with EBV as well. Black seed oil has been shown to help with h pylori as well. 
Since starting these my fatigue is greatly improved. My reflux is practically gone and I’m actually able to do squats ( two years ago I could do 300 squats a day but since Covid started ( I thought I had covid back in 2020 but negative tests) I couldn’t do ten squats without feeling like my legs would fall off. Yesterday I did over 100 where a week ago couldn’t.  These might be good options. There are a lot of benefits to black seed oil ( nigella sativa) and oil of oregano as well as ashwagandha. 
I haven’t felt this good in a long time. 
Black seed oil and oil of oregano both can help with EBV and also blastocystis hominis ( another suspect in hashimotos).  Hopefully this helps someone  "
Covid,https://connect.mayoclinic.org/discussion/still-on-oxygen-after-a-year/,Still on oxygen after a year.,"I had Covid November, 2021. I was taken by ambulance to the hospital with a pulse ox of 68% . I had Covid pneumonia and ARDS. I was in the hospital over a month and 11 days were in ICU. My insurance denied pulmonary rehab. (Aetna). I was sent home in late December on 10L oxygen via nasal cannula. I’m an RN and refused discharge. I was not ready to go home. My sats were in low 80s and the trip home and up my stairs was a nightmare. Almost called the ambulance! 
Now it’s over a year later and I’ve done my own rehab along with YouTube. I’m on 3-4L to ambulate in my home. I have to use a tank and Oximizer at 5L when I walk long distances…which is only about 50ft. Did anyone deal with this??? Were you able to wean off the oxygen?? I’ve had enough!!!!! "
Covid,https://connect.mayoclinic.org/discussion/symptoms-throughout-the-day/,Symptoms throughout the day: A pattern is emerging,"I am 5 weeks post covid positive test and I find that there seems to be a pattern emerging.  I feel okay most mornings (especially after eating), okay until the mid to late afternoon and then some days I crash.  I get tired and sometimes get those pesky palpitations and light headedness. After dinner, I feel a lot better again, and after a hot shower generally even better.  This happens even if I have a mid afternoon snack.  I also seem to have better blood pressure readings in the evening. has anyone else experiences this? "
Covid,https://connect.mayoclinic.org/discussion/digestion-complications-after-covid/,Digestion complications after COVID ,"I had covid in May it was pretty bad, but was able to isolate. I have had symptoms come back and some days I have been fine, but for the past month I have experiences with Severe Constipation, being Shaky, dizziness, migraine headaches, loss of appetite and vomiting, but no fevers. I have been so distorted I can't go in to work or drive. I can't even clean my home without feeling as though I am going to faint. I have tried using laxatives, but they don't work. I am now dealing with fecal impactions  "
